{"nodes":[{"x":500,"y":600,"z":70,"name":"IronNode"}],"timestamp":1793042428,"mobs":[{"x":1000,"y":2000,"z":30,"name":"Crab"},{"x":-3000,"y":4000,"z":55,"name":"C /Game/Maps/Main.Main:PersistentLevel.BP"}],"mob_count":2,"node_count":1,"players":[{"display_name":"Jörg","name":"Jörg","player_id":101,"actor_id":"BP_R5Character_C_101","z":150,"y":-34000.25,"alive":true,"session_id":"player:101","x":12000.5},{"display_name":"Ana","name":"Ana","player_id":102,"actor_id":"BP_R5Character_C_102","z":210.75,"y":8000,"alive":true,"session_id":"player:102","x":-5000}],"player_count":2}